{
  "id": "condition:example",
  "name": "example name",
  "simple_name": "example",
  "effects": [
    "example effects"
  ],
  "source": "example source",
  "page": 1,
  "aliases": [
    "example aliases"
  ],
  "summary": "example summary",
  "special_rules": [
    "example special_rules"
  ],
  "levels": [
    {
      "level": 1,
      "effect": "example effect"
    }
  ],
  "_meta": {}
}
